{
  "$id": "https://blueprint-conformance.github.io/bce/schemas/evidence-record.schema.json",
  "$schema": "http://json-schema.org/draft-07/schema#",
  "additionalProperties": false,
  "allOf": [
    {
      "else": {
        "properties": {
          "score": {
            "type": "integer"
          }
        }
      },
      "if": {
        "properties": {
          "verdict": {
            "const": "indeterminate"
          }
        }
      },
      "then": {
        "properties": {
          "score": {
            "type": "null"
          }
        }
      }
    }
  ],
  "dependencies": {
    "manifestDigest": [
      "stackDigest"
    ],
    "stackDigest": [
      "manifestDigest"
    ]
  },
  "description": "One immutable link of the append-only, tamper-evident evidence hash-chain (src/emit.ts). `hash` is the SHA-256 of the record’s canonical body (previousHash included); `previousHash` links to the prior record’s `hash`, or the 64-zero genesis sentinel for the first record. Content-derived, deterministic: no wall-clock anywhere in the body.",
  "properties": {
    "blueprintRef": {
      "type": "string"
    },
    "ctRepoRevision": {
      "type": "string"
    },
    "hash": {
      "pattern": "^[0-9a-f]{64}$",
      "type": "string"
    },
    "id": {
      "description": "content-derived stable id: `evidence:<blueprintRef>:<hash[0..16]>`",
      "type": "string"
    },
    "manifestDigest": {
      "pattern": "^[0-9a-f]{64}$",
      "type": "string"
    },
    "previousHash": {
      "pattern": "^[0-9a-f]{64}$",
      "type": "string"
    },
    "reportEvidenceRef": {
      "type": "string"
    },
    "schemaVersion": {
      "const": "1"
    },
    "score": {
      "maximum": 100,
      "minimum": 0,
      "type": [
        "integer",
        "null"
      ]
    },
    "stackDigest": {
      "pattern": "^[0-9a-f]{64}$",
      "type": "string"
    },
    "toolchain": {
      "oneOf": [
        {
          "additionalProperties": false,
          "description": "Producer/parser identity. Optional only for compatibility with historical pre-0.1.6 records; current CLI emissions always include it.",
          "properties": {
            "dependencyLock": {
              "additionalProperties": false,
              "properties": {
                "file": {
                  "const": "npm-shrinkwrap.json"
                },
                "sha256": {
                  "pattern": "^[0-9a-f]{64}$",
                  "type": "string"
                }
              },
              "required": [
                "file",
                "sha256"
              ],
              "type": "object"
            },
            "engine": {
              "additionalProperties": false,
              "properties": {
                "name": {
                  "const": "bce-engine"
                },
                "version": {
                  "type": "string"
                }
              },
              "required": [
                "name",
                "version"
              ],
              "type": "object"
            },
            "extractor": {
              "additionalProperties": false,
              "properties": {
                "kind": {
                  "enum": [
                    "ast",
                    "line-scan"
                  ],
                  "type": "string"
                },
                "profile": {
                  "enum": [
                    "next-route-handler",
                    "plugin-surface",
                    "typescript-module-graph",
                    "python-import-surface",
                    "python-module-graph"
                  ],
                  "type": "string"
                },
                "provider": {
                  "enum": [
                    "typescript-ts-morph",
                    "typescript-line-scan",
                    "python-line-scan",
                    "python-lezer"
                  ],
                  "type": "string"
                },
                "version": {
                  "type": "string"
                }
              },
              "required": [
                "kind",
                "profile",
                "provider",
                "version"
              ],
              "type": "object"
            },
            "runtime": {
              "additionalProperties": false,
              "properties": {
                "arch": {
                  "type": "string"
                },
                "node": {
                  "type": "string"
                },
                "npm": {
                  "type": "string"
                },
                "platform": {
                  "type": "string"
                }
              },
              "required": [
                "node",
                "npm",
                "platform",
                "arch"
              ],
              "type": "object"
            }
          },
          "required": [
            "engine",
            "dependencyLock",
            "runtime",
            "extractor"
          ],
          "type": "object"
        },
        {
          "additionalProperties": false,
          "properties": {
            "dependencyLock": {
              "additionalProperties": false,
              "properties": {
                "file": {
                  "const": "npm-shrinkwrap.json"
                },
                "sha256": {
                  "pattern": "^[0-9a-f]{64}$",
                  "type": "string"
                }
              },
              "required": [
                "file",
                "sha256"
              ],
              "type": "object"
            },
            "engine": {
              "additionalProperties": false,
              "properties": {
                "name": {
                  "const": "bce-engine"
                },
                "version": {
                  "type": "string"
                }
              },
              "required": [
                "name",
                "version"
              ],
              "type": "object"
            },
            "providers": {
              "items": {
                "oneOf": [
                  {
                    "additionalProperties": false,
                    "properties": {
                      "evidenceClass": {
                        "const": "staticAst"
                      },
                      "kind": {
                        "enum": [
                          "ast",
                          "line-scan"
                        ],
                        "type": "string"
                      },
                      "profile": {
                        "enum": [
                          "next-route-handler",
                          "plugin-surface",
                          "typescript-module-graph",
                          "python-import-surface",
                          "python-module-graph"
                        ],
                        "type": "string"
                      },
                      "provider": {
                        "enum": [
                          "typescript-ts-morph",
                          "typescript-line-scan",
                          "python-line-scan",
                          "python-lezer"
                        ],
                        "type": "string"
                      },
                      "version": {
                        "type": "string"
                      }
                    },
                    "required": [
                      "kind",
                      "profile",
                      "provider",
                      "version",
                      "evidenceClass"
                    ],
                    "type": "object"
                  },
                  {
                    "additionalProperties": false,
                    "properties": {
                      "evidenceClass": {
                        "const": "declaredStack"
                      },
                      "provider": {
                        "const": "selected-stack-v1"
                      },
                      "version": {
                        "type": "string"
                      }
                    },
                    "required": [
                      "evidenceClass",
                      "provider",
                      "version"
                    ],
                    "type": "object"
                  }
                ]
              },
              "minItems": 1,
              "type": "array"
            },
            "runtime": {
              "additionalProperties": false,
              "properties": {
                "arch": {
                  "type": "string"
                },
                "node": {
                  "type": "string"
                },
                "npm": {
                  "type": "string"
                },
                "platform": {
                  "type": "string"
                }
              },
              "required": [
                "node",
                "npm",
                "platform",
                "arch"
              ],
              "type": "object"
            }
          },
          "required": [
            "engine",
            "dependencyLock",
            "runtime",
            "providers"
          ],
          "type": "object"
        }
      ]
    },
    "traceId": {
      "description": "the chain key (blueprint id — one chain per subsystem)",
      "type": "string"
    },
    "verdict": {
      "enum": [
        "pass",
        "fail",
        "indeterminate"
      ],
      "type": "string"
    },
    "violationCount": {
      "minimum": 0,
      "type": "integer"
    }
  },
  "required": [
    "schemaVersion",
    "id",
    "traceId",
    "blueprintRef",
    "ctRepoRevision",
    "score",
    "verdict",
    "violationCount",
    "reportEvidenceRef",
    "previousHash",
    "hash"
  ],
  "title": "EvidenceRecord",
  "type": "object"
}
