{
  "blueprintRef": "bce-engine-architecture@0.1.0",
  "ctRepoRevision": "7ce50b4da45db8ca28f9a195e80a863e56735b19",
  "hash": "5f43bd16dade5a644be4c992b232f077161aa477a6784f4be205817c13f96bb4",
  "id": "evidence:bce-engine-architecture@0.1.0:5f43bd16dade5a64",
  "previousHash": "0000000000000000000000000000000000000000000000000000000000000000",
  "reportEvidenceRef": "architecture-graph.json@sha256:d2fc7fec00292d00b02978948218dcd015b9dfbc5164a5bcb59c15357371b8b3",
  "schemaVersion": "1",
  "score": 100,
  "traceId": "bce-engine-architecture",
  "verdict": "pass",
  "violationCount": 0
}
